{"checksum":{"algorithm":"SHA-256","canonicalization":"JCS","covers":"ledger-without-checksum","sha256":"92338285b720869f76b69e3114c30af61b7a600a37fdbbf2ffe6f95ea6df3be4"},"evidence":{"files":[{"bytes":2270,"path":"evidence-manifest.json","sha256":"8f9b0971974d0d1f0f44f1650b89c9a58c645d48f225157ac83f75ae4a472885"},{"bytes":36197,"path":"inputs/producer-input.lock.json","sha256":"5db831e044429eccea59d088673aed1beb5dfd21768a982b7c8ab91b11f86779"},{"bytes":40959,"path":"legal-inventory.json","sha256":"af0e2f2aff80643cd548497efb833deb542c4514efdd73b7e461d38586896120"},{"bytes":807,"path":"manifests/model-detector.json","sha256":"1474988e85e6f62d86f5eba53761dec830cd070bf158b5ae5af675d91572db05"},{"bytes":810,"path":"manifests/model-recognizer.json","sha256":"14d03d545fa9ab374561856ab0d4ad49826011516abf64b6de57af6ff732e5c1"},{"bytes":33088,"path":"manifests/package-lock.json","sha256":"27a8f7fa52cb48b0bbc623ad80a6e2621cbf4476134d1c9210090c9b8fec9f09"},{"bytes":2955,"path":"platform-manifest.json","sha256":"d08a5967dc6d95de2f6d6ed744d0b91376b1e2032e3511e596f9784fbf271810"}],"inputLock":{"bytes":36197,"path":"inputs/producer-input.lock.json","sha256":"5db831e044429eccea59d088673aed1beb5dfd21768a982b7c8ab91b11f86779"},"legalInventory":{"bytes":40959,"path":"legal-inventory.json","sha256":"af0e2f2aff80643cd548497efb833deb542c4514efdd73b7e461d38586896120"},"manifest":{"bytes":2270,"path":"evidence-manifest.json","sha256":"8f9b0971974d0d1f0f44f1650b89c9a58c645d48f225157ac83f75ae4a472885"},"modelManifests":{"detector":{"bytes":807,"path":"manifests/model-detector.json","sha256":"1474988e85e6f62d86f5eba53761dec830cd070bf158b5ae5af675d91572db05"},"recognizer":{"bytes":810,"path":"manifests/model-recognizer.json","sha256":"14d03d545fa9ab374561856ab0d4ad49826011516abf64b6de57af6ff732e5c1"}},"packageLock":{"bytes":33088,"path":"manifests/package-lock.json","sha256":"27a8f7fa52cb48b0bbc623ad80a6e2621cbf4476134d1c9210090c9b8fec9f09"},"platformManifest":{"bytes":2955,"path":"platform-manifest.json","sha256":"d08a5967dc6d95de2f6d6ed744d0b91376b1e2032e3511e596f9784fbf271810"}},"image":{"architecture":"amd64","baseImageDigests":["sha256:8c97ebedc32fd60935cdf5992e935753e2a0f98231830028050e1e04bd3c13c2"],"configDigest":"sha256:24dd4b1fd42006649f730c45cbbc88b37ef0291bbb749c18ea921323195db312","imageIndexDigest":"sha256:d08a5967dc6d95de2f6d6ed744d0b91376b1e2032e3511e596f9784fbf271810","imageRef":"ghcr.io/bluetape4k/paddleocr-service@sha256:d08a5967dc6d95de2f6d6ed744d0b91376b1e2032e3511e596f9784fbf271810","os":"linux","packageLockSha256":"27a8f7fa52cb48b0bbc623ad80a6e2621cbf4476134d1c9210090c9b8fec9f09","platformManifestDigest":"sha256:d08a5967dc6d95de2f6d6ed744d0b91376b1e2032e3511e596f9784fbf271810","targetPlatform":"linux/amd64","variant":null},"kind":"IMAGE_MODEL_LEDGER","licenseNotice":{"complete":true,"files":[{"bytes":16243,"kind":"license","path":"legal/models/PP-OCRv5_mobile_det.MODEL_CARD.md","sha256":"4cc20ad6d41af86b3ce9885ffb0956e152574a2eb14179aeb07fd2d3956161ca"},{"bytes":204,"kind":"notice","path":"legal/models/PP-OCRv5_mobile_det.NOTICE.txt","sha256":"638a54c6cfb0fc69f7a7aca2d375b35f6f39b6b99a6988a34abd2891751f2531"},{"bytes":16075,"kind":"license","path":"legal/models/PP-OCRv5_mobile_rec.MODEL_CARD.md","sha256":"b02727443cef4904a9ee12accdfaf66fcbada7b93a1a05c40dde7582291ba28c"},{"bytes":204,"kind":"notice","path":"legal/models/PP-OCRv5_mobile_rec.NOTICE.txt","sha256":"fcb2ceaf16590e0029a443a4daf698257d7978b05d7e3948c334608157268ac1"}],"inventoryPath":"legal-inventory.json","inventorySha256":"af0e2f2aff80643cd548497efb833deb542c4514efdd73b7e461d38586896120","verified":true},"model":{"models":[{"archiveBytes":4935680,"archiveSha256":"50446e5d01ac2a73d5319c89513281f6578414c888c602f9af13f93feefffc58","archiveType":"tar","files":[{"bytes":229777,"path":"models/detector/inference.json","sha256":"05feef1acb00aa4cd7362b15f7f501fc4f99d7b1fa73c1c871e0c7b1504b0f5c"},{"bytes":4692937,"path":"models/detector/inference.pdiparams","sha256":"afa1820cb16c1fd0dad589d0f8b389139061c1ef6d68019685fd07be997dda5b"},{"bytes":903,"path":"models/detector/inference.yml","sha256":"98069072e1b6b37d727fd9d9f11725faa46d6ea0de012f2ed26caea011c37699"}],"licenseExpression":"Apache-2.0","licensePath":"legal/models/PP-OCRv5_mobile_det.MODEL_CARD.md","licenseSha256":"4cc20ad6d41af86b3ce9885ffb0956e152574a2eb14179aeb07fd2d3956161ca","mediaType":"application/x-tar","modelId":"PP-OCRv5_mobile_det","modelRevision":"ffb64904d23708863ff5b8da312a5cbd52a7f462","noticePath":"legal/models/PP-OCRv5_mobile_det.NOTICE.txt","noticeSha256":"638a54c6cfb0fc69f7a7aca2d375b35f6f39b6b99a6988a34abd2891751f2531","role":"detector","sourceId":"paddlex","sourceUrl":"https://paddle-model-ecology.bj.bcebos.com/paddlex/official_inference_model/paddle3.0.0/PP-OCRv5_mobile_det_infer.tar","treeSha256":"9263307ff8b2863cc3764f63e16d4d5317ec7d0012627382d41a67411af5844a"},{"archiveBytes":16834560,"archiveSha256":"566b9512b34e34a9f0db54d87b51fa5a0b9ed2cf1ab7e49728cc0b8b5a64f414","archiveType":"tar","files":[{"bytes":217724,"path":"models/recognizer/inference.json","sha256":"24587345250c7332d0fc6f9a44e794d078cdaeb64c302fef906f325619de2569"},{"bytes":16458665,"path":"models/recognizer/inference.pdiparams","sha256":"2460da90875937c94db97eba74ae3d9e5d4c4c57c42f1f41531c09a26bcc771a"},{"bytes":148345,"path":"models/recognizer/inference.yml","sha256":"5dfeb2777f6d0db8177d8128a8acfcf6e6276dc4ac73ea3bf0dc06d6a5e85d8e"}],"licenseExpression":"Apache-2.0","licensePath":"legal/models/PP-OCRv5_mobile_rec.MODEL_CARD.md","licenseSha256":"b02727443cef4904a9ee12accdfaf66fcbada7b93a1a05c40dde7582291ba28c","mediaType":"application/x-tar","modelId":"PP-OCRv5_mobile_rec","modelRevision":"ffb64904d23708863ff5b8da312a5cbd52a7f462","noticePath":"legal/models/PP-OCRv5_mobile_rec.NOTICE.txt","noticeSha256":"fcb2ceaf16590e0029a443a4daf698257d7978b05d7e3948c334608157268ac1","role":"recognizer","sourceId":"paddlex","sourceUrl":"https://paddle-model-ecology.bj.bcebos.com/paddlex/official_inference_model/paddle3.0.0/PP-OCRv5_mobile_rec_infer.tar","treeSha256":"76ad80b3557fc2a145ea5c2e65746d387860498eed93f337f2b675477a7d185c"}],"pairBindingSha256":"d2f455ea0e0a34cfa8fac7bba38887cf136d62525e69cf9f433eac8009d9dd8f"},"producer":{"builderIdentity":"github-hosted/ubuntu-24.04","oidcIssuer":"https://token.actions.githubusercontent.com","ref":"refs/heads/develop","repository":"bluetape4k/bluetape4k-image","runnerEnvironment":"github-hosted","signerIdentity":"bluetape4k/bluetape4k-image/.github/workflows/paddleocr-producer.yml","sourceRevision":"367275a58681e7a7f04fc5f078d70e694a13951a","workflow":".github/workflows/paddleocr-producer.yml","workflowRef":"bluetape4k/bluetape4k-image/.github/workflows/paddleocr-producer.yml@refs/heads/develop","workflowRunId":"34258892748.1","workflowSha":"367275a58681e7a7f04fc5f078d70e694a13951a"},"schemaVersion":1,"scope":{"deferred":["609-D","609-E","544-B","547"],"gate":"609-C"},"status":"PASS","trustPolicy":{"allowedBuilderIdentities":["github-hosted/ubuntu-24.04"],"allowedOidcIssuers":["https://token.actions.githubusercontent.com"],"allowedRepositories":["bluetape4k/bluetape4k-image"],"allowedSignerIdentities":["bluetape4k/bluetape4k-image/.github/workflows/paddleocr-producer.yml"],"allowedWorkflowPaths":[".github/workflows/paddleocr-producer.yml"],"allowedWorkflowRefs":["bluetape4k/bluetape4k-image/.github/workflows/paddleocr-producer.yml@refs/heads/develop"],"allowlistNonEmpty":true,"policySha256":"8d9dce8676b72582b614badc0bcff83f2f495e6411d370d34a4e5e5076274768","sourceRevisionPolicy":"full-commit"},"verification":{"baseDigestsMatch":true,"canonicalJson":true,"indexSelectsPlatformManifest":true,"licenseNoticeVerified":true,"manifestConfigMatches":true,"modelFilesMatch":true,"modelTreeRecomputed":true,"packageLockMatches":true,"pairBindingMatches":true,"trustPolicyMatched":true}}
